id,variant,tags,tier,rarity,fleet pts,op cost,formation,range,attackRunRange,attackPositionOffset,num,role,role desc,refit,base value,,,,,,,,,,,,,number
ot_man_american_m,ot_man_30cal,"fighter3, fighter, usawi_bp, USA, independent_of_carrier, no_drop, rapid_reform",1,,2,2,BOX,2000,600,0,3,SUPPORT,Defensive Infantry,6,250,,,,,,,,,,,,,
ot_man_american_a,ot_man_bar,"fighter2, fighter, usawi_bp, USA, independent_of_carrier, no_drop, attack_at_an_angle, rapid_reform",1,,3,3,V,3000,600,0,4,BOMBER,Offensive Infantry,4,225,,,,,,,,,,,,,
ot_man_american,ot_man_garand,"fighter1, fighter, usawi_bp, USA, independent_of_carrier, no_drop, rapid_reform",1,,1,1,V,4000,600,0,6,INTERCEPTOR,Infantry,3,200,,,,,,,,,,,,,
,,,,,,,,,,,,,,,,,,,,,,,,,,,,
,,,,,,,,,,,,,,,,,,,,,,,,,,,,
ot_man_german_m,ot_man_792,"fighter3, fighter, gerwi_bp, GER, independent_of_carrier, no_drop, rapid_reform",1,,2,2,V,2000,600,0,3,SUPPORT,Defensive Infantry,6,250,,,,,,,,,,,,,
ot_man_german_a,ot_man_stg44,"fighter2, fighter, gerwi_bp, GER, independent_of_carrier, no_drop, attack_at_an_angle, rapid_reform",1,,3,3,V,3000,600,0,4,BOMBER,Offensive Infantry,4,225,,,,,,,,,,,,,
ot_man_german,ot_man_kar98,"fighter1, fighter, gerwi_bp, GER, independent_of_carrier, no_drop, rapid_reform",1,,1,1,BOX,4000,600,0,6,INTERCEPTOR,Infantry,3,200,,,,,,,,,,,,,